{"claims":[{"claimId":"claim-1","confidence":"high","evidenceIds":["evidence-1"],"text":"Invalid duplicate-source claim."}],"createdAt":"2026-08-30T00:00:00Z","evidence":[{"evidenceId":"evidence-1","observation":"Synthetic indicator equals 42 units.","relation":"supports","sourceId":"source-1"}],"providerOutcomes":[],"requestId":"request-duplicate","resultId":"result-request-duplicate","schemaVersion":"aioffice.research.v1","sources":[{"collectedAt":"2026-08-30T00:00:00Z","freshness":"fresh","locator":"https://publisher.test/research/alpha","sourceId":"source-1"},{"collectedAt":"2026-08-30T00:00:00Z","freshness":"fresh","locator":"https://archive.test/research/duplicate","sourceId":"source-1"}],"status":"failed","taskId":"task-duplicate","usage":{"actualCostKrw":0,"estimatedCredits":0,"estimatedRequests":0,"estimatedTokens":0,"simulated":true},"warnings":[]}
