{"claims":[{"claimId":"claim-1","confidence":"low","evidenceIds":["evidence-1","evidence-2"],"text":"The synthetic indicator is 42 units."}],"createdAt":"2026-08-30T00:00:00Z","evidence":[{"evidenceId":"evidence-1","observation":"Synthetic indicator equals 42 units.","relation":"supports","sourceId":"source-1"},{"evidenceId":"evidence-2","observation":"Synthetic indicator equals 39 units.","relation":"contradicts","sourceId":"source-2"}],"providerOutcomes":[{"providerId":"mock-search","retryable":false,"status":"success"}],"requestId":"request-source_conflict","resultId":"result-request-source_conflict","schemaVersion":"aioffice.research.v1","sources":[{"collectedAt":"2026-08-30T00:00:00Z","freshness":"fresh","locator":"https://publisher.test/research/alpha","publishedAt":"2026-08-29T00:00:00Z","sourceId":"source-1"},{"collectedAt":"2026-08-30T00:00:00Z","freshness":"fresh","locator":"https://archive.test/research/beta","publishedAt":"2026-08-29T01:00:00Z","sourceId":"source-2"}],"status":"completed","taskId":"task-source_conflict","usage":{"actualCostKrw":0,"estimatedCredits":1,"estimatedRequests":1,"estimatedTokens":120,"simulated":true},"warnings":["source_conflict"]}
