{"claims":[{"claimId":"claim-1","confidence":"high","evidenceIds":["evidence-1"],"text":"The synthetic indicator is 42 units."}],"createdAt":"2026-08-30T00:00:00Z","evidence":[{"evidenceId":"evidence-1","observation":"Synthetic indicator equals 42 units.","relation":"supports","sourceId":"source-1"}],"providerOutcomes":[{"providerId":"mock-search","retryable":false,"status":"success"},{"providerId":"mock-archive","retryable":true,"status":"timeout"}],"requestId":"request-partial","resultId":"result-request-partial","schemaVersion":"aioffice.research.v1","sources":[{"collectedAt":"2026-08-30T00:00:00Z","freshness":"fresh","locator":"https://publisher.test/research/alpha","publishedAt":"2026-08-29T00:00:00Z","sourceId":"source-1"}],"status":"partial","taskId":"task-partial","usage":{"actualCostKrw":0,"estimatedCredits":2,"estimatedRequests":2,"estimatedTokens":120,"simulated":true},"warnings":["provider_timeout","partial_result"]}
