{"claims":[],"createdAt":"2026-08-30T00:00:00Z","evidence":[],"providerOutcomes":[{"providerId":"mock-search","retryable":false,"status":"success"}],"requestId":"request-usage","resultId":"result-request-usage","schemaVersion":"aioffice.research.v1","sources":[],"status":"completed","taskId":"task-usage","usage":{"actualCostKrw":0,"estimatedCredits":5,"estimatedRequests":4,"estimatedTokens":600,"simulated":true},"warnings":[]}
