{"claims":[],"createdAt":"2026-08-30T00:00:00Z","evidence":[],"providerOutcomes":[{"providerId":"mock-search","retryable":true,"status":"timeout"}],"requestId":"request-timeout","resultId":"result-request-timeout","schemaVersion":"aioffice.research.v1","sources":[],"status":"retryable","taskId":"task-timeout","usage":{"actualCostKrw":0,"estimatedCredits":1,"estimatedRequests":1,"estimatedTokens":0,"simulated":true},"warnings":["provider_timeout"]}
