{"claims":[],"createdAt":"2026-08-30T00:00:00Z","evidence":[],"providerOutcomes":[{"providerId":"mock-search","retryAfterSeconds":30,"retryable":true,"status":"rate_limited"}],"requestId":"request-rate_limited","resultId":"result-request-rate_limited","schemaVersion":"aioffice.research.v1","sources":[],"status":"retryable","taskId":"task-rate_limited","usage":{"actualCostKrw":0,"estimatedCredits":1,"estimatedRequests":1,"estimatedTokens":0,"simulated":true},"warnings":["provider_rate_limited"]}
