{"claims":[{"claimId":"claim-1","confidence":"high","evidenceIds":["evidence-1"],"text":"The synthetic indicator is 42 units."}],"createdAt":"2026-08-30T00:00:00Z","evidence":[{"evidenceId":"evidence-1","observation":"Synthetic indicator equals 42 units.","relation":"supports","sourceId":"source-1"}],"providerOutcomes":[{"providerId":"mock-search","retryable":false,"status":"success"}],"requestId":"request-stale_source","resultId":"result-request-stale_source","schemaVersion":"aioffice.research.v1","sources":[{"collectedAt":"2026-08-30T00:00:00Z","freshness":"stale","locator":"https://publisher.test/research/alpha","publishedAt":"2026-01-01T00:00:00Z","sourceId":"source-1"}],"status":"completed","taskId":"task-stale_source","usage":{"actualCostKrw":0,"estimatedCredits":1,"estimatedRequests":1,"estimatedTokens":120,"simulated":true},"warnings":["stale_source"]}
